{
  "$schema": "https://json-schema.org/draft/2020-12/schema",
  "$id": "https://whatifexplains.local/qa-report.schema.json",
  "title": "What If Explains QA Report",
  "type": "object",
  "required": ["episodeId", "stateRevision", "generatedAt", "overallStatus", "checks"],
  "additionalProperties": false,
  "properties": {
    "episodeId": {"type": "string", "minLength": 1},
    "stateRevision": {"type": "integer", "minimum": 0},
    "generatedAt": {"type": "string"},
    "overallStatus": {"enum": ["PASS", "FAIL", "UNVERIFIED"]},
    "checks": {
      "type": "array",
      "minItems": 1,
      "items": {
        "type": "object",
        "required": ["name", "status", "detail"],
        "additionalProperties": false,
        "properties": {
          "name": {"type": "string", "minLength": 1},
          "status": {"enum": ["PASS", "FAIL", "UNVERIFIED"]},
          "detail": {"type": "string"}
        }
      }
    }
  }
}
